### ISSUE TITLE
NATS PING/PONG does not reconnects correctly when client can't talk with the server

### ISSUE THREAD

**Issue by liviozanol** [nats-io/nats.py#671]
### Observed behavior

It seems that even with the `ping_interval` and `max_outstanding_pings` configured properly if the nats client lose connection to the server (IE the server is network unreachable), the nats client will not teardown the connection on the expected time.

Below a pcap showing the behavior with default timers. 192.168.0.1:1234 is a NATS Jetstream server
```
#OK - ping/pong working properly
15:16:45.510365 IP 192.168.0.2.53674 > 192.168.0.1.1234: Flags [P.], seq 964888961:964888989, ack 3349841365, win 501, options [nop,nop,TS val 3739277461 ecr 3920449588], length 28
15:16:45.510693 IP 192.168.0.1.1234 > 192.168.0.2.53674: Flags [P.], seq 1:29, ack 28, win 501, options [nop,nop,TS val 3920569588 ecr 3739277461], length 28
15:16:45.510710 IP 192.168.0.2.53674 > 192.168.0.1.1234: Flags [.], ack 29, win 501, options [nop,nop,TS val 3739277461 ecr 3920569588], length0

# Traffic was blocked. Client sends PING, does not receive response but doesn't tear down the connection.
15:18:45.511920 IP 192.168.0.2.53674 > 192.168.0.1.1234: Flags [P.], seq 28:56, ack 29, win 501, options [nop,nop,TS val 3739397462 ecr 3920569588], length 28
15:18:45.716279 IP 192.168.0.2.53674 > 192.168.0.1.1234: Flags [P.], seq 28:56, ack 29, win 501, options [nop,nop,TS val 3739397667 ecr 3920569588], length 28
15:18:45.924277 IP 192.168.0.2.53674 > 192.168.0.1.1234: Flags [P.], seq 28:56, ack 29, win 501, options [nop,nop,TS val 3739397875 ecr 3920569588], length 28
15:18:46.360284 IP 192.168.0.2.53674 > 192.168.0.1.1234: Flags [P.], seq 28:56, ack 29, win 501, options [nop,nop,TS val 3739398311 ecr 3920569588], length 28
15:18:47.192309 IP 192.168.0.2.53674 > 192.168.0.1.1234: Flags [P.], seq 28:56, ack 29, win 501, options [nop,nop,TS val 3739399143 ecr 3920569588], length 28
15:18:48.856277 IP 192.168.0.2.53674 > 192.168.0.1.1234: Flags [P.], seq 28:56, ack 29, win 501, options [nop,nop,TS val 3739400807 ecr 3920569588], length 28
15:18:52.184299 IP 192.168.0.2.53674 > 192.168.0.1.1234: Flags [P.], seq 28:56, ack 29, win 501, options [nop,nop,TS val 3739404135 ecr 3920569588], length 28
15:18:58.840290 IP 192.168.0.2.53674 > 192.168.0.1.1234: Flags [P.], seq 28:56, ack 29, win 501, options [nop,nop,TS val 3739410791 ecr 3920569588], length 28
15:19:12.152328 IP 192.168.0.2.53674 > 192.168.0.1.1234: Flags [P.], seq 28:56, ack 29, win 501, options [nop,nop,TS val 3739424103 ecr 3920569588], length 28
15:19:39.800289 IP 192.168.0.2.53674 > 192.168.0.1.1234: Flags [P.], seq 28:56, ack 29, win 501, options [nop,nop,TS val 3739451751 ecr 3920569588], length 28
15:20:33.048292 IP 192.168.0.2.53674 > 192.168.0.1.1234: Flags [P.], seq 28:56, ack 29, win 501, options [nop,nop,TS val 3739504999 ecr 3920569588], length 28
15:22:19.544297 IP 192.168.0.2.53674 > 192.168.0.1.1234: Flags [P.], seq 28:56, ack 29, win 501, options [nop,nop,TS val 3739611495 ecr 3920569588], length 28
15:24:20.376285 IP 192.168.0.2.53674 > 192.168.0.1.1234: Flags [P.], seq 28:56, ack 29, win 501, options [nop,nop,TS val 3739732327 ecr 3920569588], length 28
15:26:21.208235 IP 192.168.0.2.53674 > 192.168.0.1.1234: Flags [P.], seq 28:56, ack 29, win 501, options [nop,nop,TS val 3739853159 ecr 3920569588], length 28
15:28:22.040312 IP 192.168.0.2.53674 > 192.168.0.1.1234: Flags [P.], seq 28:56, ack 29, win 501, options [nop,nop,TS val 3739973991 ecr 3920569588], length 28
15:30:22.872301 IP 192.168.0.2.53674 > 192.168.0.1.1234: Flags [P.], seq 28:56, ack 29, win 501, options [nop,nop,TS val 3740094823 ecr 3920569588], length 28
15:32:23.704231 IP 192.168.0.2.53674 > 192.168.0.1.1234: Flags [P.], seq 28:56, ack 29, win 501, options [nop,nop,TS val 3740215655 ecr 3920569588], length 28


# Reconnection finally attempted
15:34:24.538864 IP 192.168.0.2.52702 > 192.168.0.1.1234: Flags [S], seq 870453250, win 65495, options [mss 65495,sackOK,TS val 3740336489 ecr 0,nop,wscale 7], length 0
15:34:25.560336 IP 192.168.0.2.52702 > 192.168.0.1.1234: Flags [S], seq 870453250, win 65495, options [mss 65495,sackOK,TS val 3740337511 ecr 0,nop,wscale 7], length 0

```

### Expected behavior

Connection should be teardown as soon as the `max_outstanding_pings` threshold is reached

### Server and client version

nats-py==2.7.2

### Steps to reproduce

This is easy to reproduce. Just spin a server, connect a client to it and make the client not able to reach the server anymore (add route to null/loopback, or create an iptables rule for example)

**Comment by fielding** [comment]
could you check and see if https://github.com/nats-io/nats.py/pull/675 helps at all?

**Comment by liviozanol** [comment]
> could you check and see if [#675](https://github.com/nats-io/nats.py/pull/675) helps at all?

Thanks! We will have a look and do some tests

**Comment by jmentzer722** [comment]
> could you check and see if [#675](https://github.com/nats-io/nats.py/pull/675) helps at all?

@fielding I've been working with @liviozanol to investigate this further. Unfortunately it looks like [#675](https://github.com/nats-io/nats.py/pull/675) does not resolve this particular issue.

What we've found is that the `_attempt_reconnect()` function is stuck waiting for the transport to close. It was only able to break out of that deadlock when it received a TimeoutError 15 minutes later. I haven't been able to find where the ~15 timeout comes from, but I suspect it's something from the OS forcefully closing the socket.

Note: below traceback is an older capture from 3.8, but I confirmed it hangs in the exact same spot in 3.10 also.
```
Traceback (most recent call last):
  File "/usr/local/lib/python3.8/dist-packages/nats/aio/client.py", line 1419, in _attempt_reconnect
    await self._transport.wait_closed()
  File "/usr/local/lib/python3.8/dist-packages/nats/aio/transport.py", line 180, in wait_closed
    return await self._io_writer.wait_closed()
  File "/usr/lib/python3.8/asyncio/streams.py", line 359, in wait_closed
    await self._protocol._get_close_waiter(self)
  File "/usr/lib/python3.8/asyncio/selector_events.py", line 848, in _read_ready__data_received
    data = self._sock.recv(self.max_size)
TimeoutError: [Errno 110] Connection timed out
```

Just hacking around during investigation it does look like wrapping the transport call with an asyncio timeout allows NATS to at least move forward with the reconnect attempt.
```
await asyncio.wait_for(self._transport.wait_closed(), timeout=self.options['reconnect_time_wait'])
```
However that seems non-ideal since it is abandoning the socket without proper closure. I also see the TimeoutError from the original socket closure still raised after ~15 minutes, but it doesn't seem to impact NATS.

**Comment by johanlantz** [comment]
Came across this today as well. I test by just stopping the nats server.

I use NATS in two places. One is peridically asking for some information using NATS. This code does get the disconnected_cb as soon as the periodical check runs. It reconnects fine once NATS is back up again. 

In the second scenario NATS is invoced through a webpage interaction so if I make a first successful run and then shut down NATS, I would expect that the PING detects that the connection is down after the configured time but none of the callbacks is called.

**Comment by johanlantz** [comment]
@caspervonb I'm trying to find the code from https://github.com/nats-io/nats.py/commit/632f8c453cf275a9a9717988ab012e2167d120e0
on main. Did the final implementation change since that reference?
